pmid,year,title,first_last_authors,journal,species,cell_line,n_cells_per_aggregate,chir_uM,chir_onset_h,chir_offset_h,base_media,harvest_timepoints_h,imaging_modalities,fluorescent_reporters,morphology_quantified,morphology_metric,morphology_n,morphology_timepoint_h,elongation_pct,shape_distribution_figure,variability_addressed,key_perturbation,key_finding,full_text_source,pmcid,extraction_reviewed
34608934,2021,Huntingtin CAG expansion impairs germ layer patterning in synthetic human 2D gastruloids through polarity defects.,Szilvia … H,"Development (Cambridge, England)",human,RUES2,not reported,6,24,not reported,MEF-CM,"1, 24, 48","widefield-fluorescence, live-imaging","SOX2-mCitrine, SMAD1-RFP, SMAD2-mCitrine, H2B-mCitrine, H2B-mCherry",Y,"SOX2+ domain area, SOX2 intensity",100,48,not reported,Y,Y,"HTT CAG expansion length variation (20CAG, 56CAG, 72CAG controls vs. HTT−/− deletion)","HTT-CAG expansion impairs germ layer patterning in 2D gastruloids through polarity-dependent defects in TGFβ signaling, causing reduced ectodermal SOX2+ domain size that correlates with CAG length.",PMC,8513611.0,False
33818562,2021,A Microfluidics Approach for the Functional Investigation of Signaling Oscillations Governing Somitogenesis.,J … F,Journal of visualized experiments : JoVE,mouse,not reported,not reported,not reported,not reported,not reported,not reported,not reported,not reported,not reported,N,not reported,not reported,not reported,not reported,N,N,microfluidic entrainment of signaling oscillations with pathway modulator pulses,"Microfluidics enables functional investigation of signaling oscillations governing somitogenesis through modulation of oscillation period, phase-relationships, and spatial gradients of pathway modulators, and can be adapted for gastruloids and organoids.",abstract only,,False
34425190,2021,"In vitro teratogenicity testing using a 3D, embryo-like gastruloid system.",Veronika … Naomi,"Reproductive toxicology (Elmsford, N.Y.)",both,"E14Tg2A, T/Bra::GFP, RUES2-GLR","300 (mouse), 400 (human)","3.25 (human pre-treatment), 0.5 (human aggregation)","0 (human pre-treatment on day 4 of adherent culture), 48 (mouse between 48-72h)","24 (human pre-treatment), not reported (mouse)","N2B27 (mouse), Essential 6 / E6 (human)","120 (mouse), 72 (human)","brightfield, widefield-fluorescence","T/Bra::GFP (mouse), BRA-mCerulean, SOX2-mCitrine, SOX17-tdTomato (human)",Y,"aspect ratio, circularity, area",not reported,"120 (mouse), 72 (human)",not reported,Y,Y,"ATRA, valproic acid, bosentan, thalidomide, phenytoin, ibuprofen, penicillin G exposure at multiple concentrations","Gastruloids can distinguish known teratogens from non-teratogens through morphological and gene expression changes, with human gastruloids showing greater sensitivity to compound exposure than mouse gastruloids.",PMC,8522962.0,False
33340358,2021,Fate-Patterning of 2D Gastruloids and Ectodermal Colonies Using Micropatterned Human Pluripotent Stem Cells.,George … Aryeh,"Methods in molecular biology (Clifton, N.J.)",human,not reported,not reported,not reported,not reported,not reported,not reported,not reported,not reported,not reported,not reported,not reported,not reported,not reported,not reported,not reported,not reported,micropatterned human pluripotent stem cell colonies of defined size and shape,Micropatterned 2D systems allow study of self-organized patterning of germ layers at gastrulation and medial-lateral ectoderm patterning through intercellular signaling.,abstract only,,False
34021144,2021,Co-development of central and peripheral neurons with trunk mesendoderm in human elongating multi-lineage organized gastruloids.,T … L,Nature communications,human,"ED-hiPSC lines (F3.5.2, F3.2.2, F3.3.1, H3.3.1, H3.1.1, H3.4.1, A2.1.1, A2.2.1, A2.2.2)",300-400,3,0,not reported,N2B27,"24, 72, 96, 312","brightfield, widefield-fluorescence","SOX2, GATA6, DAPI",Y,"aspect ratio, L:W ratio",153,312,not reported,Y,Y,"CHIR and FGF2 pretreatment, SMAD inhibition (LDN 193189 and SB 431542), Hh-Ag1.5 supplementation",EMLOs demonstrate reproducible polarized development of interconnected CNS and PNS neurons with trunk mesendoderm and a primitive gut tube that acts as a morphological organizer of neuronal fibers.,PMC,8140076.0,False
33891870,2021,Gene expression dynamics underlying cell fate emergence in 2D micropatterned human embryonic stem cell gastruloids.,Thu … Lilianna,Stem cell reports,human,H1,not reported,not reported,not reported,not reported,mTeSR,"0, 12, 24, 44","confocal, widefield-fluorescence","POU5F1, SOX2, NANOG, GATA3, TFAP2A, T, SOX17, CDH1, CDH2, MESP1, FOXA2, NANOS3, TFAP2C",N,not reported,not reported,not reported,not reported,N,Y,BMP4 treatment in 2D micropatterned substrates,"Sequential emergence of seven cell types (EPI-like, ectoderm, mesoderm, endoderm, hPGCLCs, and ExE-like cells) occurs over 44 hours of BMP4 treatment, with prospective ectoderm and GATA3+ cells forming by 12h, mesendoderm precursors by 24h, and mature germ layers by 44h.",PMC,8185470.0,False
33217323,2021,Membrane Tension Gates ERK-Mediated Regulation of Pluripotent Cell Fate.,Henry … J,Cell stem cell,mouse,E14TG2a,not reported,3,not reported,not reported,N2B27,"8, 16, 24, 48","brightfield, confocal, widefield-fluorescence","LifeAct-GFP, Nanog, Otx2",Y,cell shape classification (round vs spread),not reported,24,not reported,Y,Y,exit from naive pluripotency via withdrawal of 2i+L inhibitors,"Membrane tension decreases as ESCs exit naive pluripotency, and this decrease in membrane tension gates ERK-mediated differentiation by regulating endocytosis rates independent of cell shape changes.",PMC,7875115.0,False
34727234,2021,Reaction-diffusion models for morphological patterning of hESCs.,Prajakta … Misha,Journal of mathematical biology,human,hESC unspecified,not reported,not reported,not reported,not reported,not reported,not reported,not reported,not reported,N,not reported,not reported,not reported,not reported,N,N,none / descriptive study,"Reaction-diffusion models with Gierer-Meinhardt equations identify three distinct regimes for BMP4, Wnt, and Nodal that produce realistic protein concentration dynamics consistent with experimental hESC patterning.",abstract only,,False
33482102,2021,Gastruloid Development Competence Discriminates Different States of Pluripotency.,Federica … Jorge,Stem cell reports,mouse,"TBV2, E14, R1, Cripto KO",300,3,48,72,N2B27,"48, 96, 120","brightfield, confocal","CDX2, NESTIN, T/BRA, SOX2, SOX17, Ki67",Y,"elongation ratio, length, volume, diameter",180,120,95,Y,Y,Cripto genetic ablation and rescue with recombinant CRIPTO or ACTIVIN A protein,"Gastruloid formation efficiency discriminates between naive and primed pluripotency states, with naive ESCs generating elongated gastruloids while primed EpiSCs fail to do so, and Cripto is essential for symmetry breaking and A-P axis formation in gastruloids.",PMC,7878839.0,False
33837289,2021,Depletion of aneuploid cells in human embryos and gastruloids.,Min … Norbert,Nature cell biology,human,not reported,not reported,not reported,not reported,not reported,not reported,not reported,not reported,not reported,N,not reported,not reported,not reported,not reported,N,N,aneuploid cell depletion in micropatterned human gastruloids,"Aneuploid cells are depleted from embryonic germ layers but not extraembryonic tissue in human gastruloids through BMP4-dependent apoptosis, demonstrating an in vitro mechanism for aneuploidy elimination.",abstract only,,False
34540831,2021,"Human Embryos, Induced Pluripotent Stem Cells, and Organoids: Models to Assess the Effects of Environmental Plastic Pollution.",Dragana … Biljana,Frontiers in cell and developmental biology,human,not reported,not reported,not reported,not reported,not reported,not reported,not reported,not reported,not reported,N,not reported,not reported,not reported,not reported,N,N,plastic pollutant exposure,"Organoids show potential for assessing effects of environmental plastic pollution on human cells by examining cytotoxic effects, gene expression changes, and ROS production, though limitations including lack of vasculature and immune cells must be addressed.",PMC,8446652.0,False
34304959,2021,3D gastruloids: a novel frontier in stem cell-based in vitro modeling of mammalian gastrulation.,C … Alexander,Trends in cell biology,mammalian,not reported,not reported,not reported,not reported,not reported,not reported,not reported,not reported,not reported,not reported,not reported,not reported,not reported,not reported,not reported,not reported,not reported,"3D gastruloids, aggregates of embryonic stem cells, recapitulate key aspects of gastrula-stage embryos and provide a tractable tool to study early mammalian post-implantation development in vitro with potential for high-throughput analysis of normal and pathological embryogenesis.",abstract only,,False
33176168,2021,Capturing Cardiogenesis in Gastruloids.,Giuliana … P,Cell stem cell,mouse,mESC unspecified,300-700,3,48,72,N2B27,"96, 120, 144, 168","brightfield, widefield-fluorescence, confocal, light-sheet, live-imaging","Hcn4-GFP, Tbx1Cre-RFP, Flk1-GFP, Mesp1-GFP, Gata6-Venus, Gata4, GFP, Brachyury, CD31, cardiac troponin T, E-Cadherin",Y,"elongation, polarization",not reported,not reported,not reported,Y,Y,"N2B27+++ medium optimization with bFGF, VEGF165, and L-ascorbic acid phosphate from 96-144 h",Gastruloids can be stimulated to form a cardiac primordium with organized spatial arrangement of early cardiac progenitors and first and second heart field compartmentalization through optimized culture conditions combining cardiogenic growth factors.,PMC,7867643.0,False
34250208,2021,Generation of Mouse Pluripotent Stem Cell-derived Trunk-like Structures: An <i>in vitro</i> Model of Post-implantation Embryogenesis.,Adriano … V,Bio-protocol,mouse,mESC unspecified,not reported,not reported,not reported,not reported,not reported,not reported,not reported,not reported,unclear,not reported,not reported,not reported,not reported,unclear,N,Matrigel extracellular matrix addition,"Addition of low percentage Matrigel to gastruloids results in formation of trunk-like structures with neural tube flanked by bilateral somites, recapitulating mid-gestational mouse embryogenesis.",abstract only,8250383.0,False
33981202,2021,Stem Cell Neurodevelopmental Solutions for Restorative Treatments of the Human Trunk and Spine.,T … L,Frontiers in cellular neuroscience,both,not reported,not reported,not reported,not reported,not reported,not reported,not reported,not reported,not reported,N,not reported,not reported,not reported,not reported,N,N,none / descriptive study,"Human stem cell developmental neurotechnologies offer promising approaches for understanding and treating trunk and spine disorders including neural tube defects, neurocristopathies, neuromuscular disorders, and neurodegeneration through disease modeling and cell replacement therapies.",PMC,8107236.0,False
33206048,2020,High-resolution transcriptional and morphogenetic profiling of cells from micropatterned human ESC gastruloid cultures.,Thu … Lilianna,eLife,both,"H1, H9",not reported,not reported,not reported,not reported,mTeSR1,44,widefield-fluorescence,"SOX2, OCT3/4, T, SOX17, CDX2, pSMAD1, SOX1, GATA3, GATA6, FOXA2, ZO-1, KRT7, AP-2α, AP-2γ, CDH1, CDH2",N,not reported,not reported,not reported,not reported,N,Y,BMP4 treatment,BMP4 treatment of hESCs cultured on ECM micro-discs for 44 hours reproducibly generates radially-arranged gastruloids containing seven distinct cell types representing three germ layers and extragonadal-like cells with primate-specific characteristics including hPGCLC and cells with amnion signatures.,PMC,7728446.0,False
32867543,2020,Measuring and Modeling Single-Cell Heterogeneity and Fate Decision in Mouse Embryos.,Jonathan … Antonio,Annual review of genetics,mouse,not reported,not reported,not reported,not reported,not reported,not reported,not reported,not reported,not reported,N,not reported,not reported,not reported,not reported,N,N,none / descriptive study,"Disentangling the role of heterogeneity in cell fate decision will likely rely on the refined integration of experiments, large-scale omics data, and mathematical modeling, complemented by the use of synthetic embryos and gastruloids as promising in vitro models.",abstract only,,False
32864586,2020,Translating Embryogenesis to Generate Organoids: Novel Approaches to Personalized Medicine.,Sounak … K,iScience,human,not reported,not reported,not reported,not reported,not reported,not reported,not reported,not reported,not reported,N,not reported,not reported,not reported,not reported,N,Y,none / descriptive study,"Stem cell-based embryo models including gastruloids will be increasingly important for personalized medicine, but efforts are needed to increase yield and reproducibility.",PMC,7441954.0,False
32076263,2020,Single-cell and spatial transcriptomics reveal somitogenesis in gastruloids.,C … Alexander,Nature,mouse,not reported,not reported,not reported,not reported,not reported,not reported,not reported,live-imaging,not reported,unclear,not reported,not reported,not reported,not reported,unclear,N,"FGF signalling reduction, Matrigel embedding","Gastruloids embedded in Matrigel generate somites with correct rostral-caudal patterning that appear sequentially in an anterior-to-posterior direction, demonstrating somitogenesis in vitro with dynamics resembling those in vivo.",abstract only,,False
32243802,2020,Gastruloids Gain Muscle: Somite Formation in Embryo-Like Structures.,A … H,Cell stem cell,mouse,not reported,not reported,not reported,not reported,not reported,not reported,not reported,not reported,not reported,N,not reported,not reported,not reported,not reported,N,N,none / descriptive study,Mouse gastruloids display significant similarities to embryos in positional lineage segregation and somite formation.,abstract only,,False
32496642,2020,Methoxyacetic acid inhibits histone deacetylase and impairs axial elongation morphogenesis of mouse gastruloids in a retinoic acid signaling-dependent manner.,W … Yusuke,Birth defects research,mouse,P19C5,not reported,not reported,not reported,not reported,"90% minimum essential medium alpha with nucleosides and GlutaMAX Supplement, 2.5% fetal bovine serum, 7.5% newborn calf serum",96,brightfield,none,Y,"aspect ratio, area",16,96,not reported,Y,Y,methoxyacetic acid (MAA) dose titration; retinoic acid signaling inhibition with BMS493,"Methoxyacetic acid impairs axial elongation morphogenesis of mouse gastruloids at teratogenic concentrations in a retinoic acid signaling-dependent manner, possibly through histone deacetylase inhibition.",PMC,8265612.0,False
32132714,2020,Publisher Correction: Single-cell and spatial transcriptomics reveal somitogenesis in gastruloids.,C … Alexander,Nature,unspecified,not reported,not reported,not reported,not reported,not reported,not reported,not reported,not reported,not reported,unclear,not reported,not reported,not reported,not reported,unclear,not reported,not reported,Publisher correction to a prior paper on somitogenesis in gastruloids.,abstract only,,False
32528178,2020,An in vitro model of early anteroposterior organization during human development.,Naomi … Alfonso,Nature,human,not reported,not reported,not reported,not reported,not reported,not reported,72,not reported,not reported,Y,elongation,not reported,72,not reported,not reported,N,none / descriptive study,Human embryonic stem cells generate gastruloids that undergo elongation along an anteroposterior axis with patterned gene expression and somitogenesis features resembling Carnegie-stage-9 embryos.,abstract only,,False
31613879,2019,"Dissecting the dynamics of signaling events in the BMP, WNT, and NODAL cascade during self-organized fate patterning in human gastruloids.",Sapna … Aryeh,PLoS biology,both,"ESI017, ESI017 GFP-β-catenin, RUES2",not reported,not reported,not reported,not reported,mTeSR1,44,widefield-fluorescence,"GFP-β-catenin, VENUS:H2B",N,not reported,not reported,not reported,not reported,N,N,"NODAL knockout via CRISPR-Cas9, WNT inhibition via IWP2, NODAL pathway inhibition via SB431542","BMP signaling initiates dynamic waves of WNT and NODAL signaling that move toward the colony center, with WNT signaling initiating mesodermal differentiation and NODAL signaling up-regulating it, rather than stable signaling gradients underlying primitive streak formation.",PMC,6814242.0,False
31175647,2019,Chick Models and Human-Chick Organizer Grafts.,Iain … H,"Methods in molecular biology (Clifton, N.J.)",human,not reported,not reported,not reported,not reported,not reported,not reported,not reported,not reported,not reported,N,not reported,not reported,not reported,not reported,N,N,interspecies chimera transplantation of hESC-derived gastruloids into chick embryo,Human organizer cells derived from hESC gastruloids self-organize to contribute to notochord-like tissue and indirectly induce host chick cells to generate neural tissue in human-chick chimeras.,abstract only,,False
31427289,2019,Mapping cell migrations and fates in a gastruloid model to the human primitive streak.,Iain … H,"Development (Cambridge, England)",both,not reported,not reported,not reported,not reported,not reported,not reported,not reported,not reported,not reported,unclear,not reported,not reported,not reported,not reported,unclear,not reported,"BMP, WNT and NODAL titration","Differing levels of BMP, WNT and NODAL lead to self-organization of human gastruloids into distinct endoderm and mesoderm subpopulations that can be mapped along an anterior-posterior axis, and fate-dependent cell migrations comparable to the mouse embryo were detected using novel cell tracking.",abstract only,6765127.0,False
30311909,2018,WNT signaling memory is required for ACTIVIN to function as a morphogen in human gastruloids.,Anna … H,eLife,human,RUES2,not reported,not reported,not reported,not reported,HUESM,"1, 48","widefield-fluorescence, confocal","RFP-SMAD1, mCitrine-SMAD2, GFP-SMAD4, H2B-mCitrine, H2B-mCherry",N,not reported,not reported,not reported,not reported,N,Y,WNT signaling pre-treatment followed by ACTIVIN stimulation; SMAD pathway inhibition with SB431542,"WNT signaling creates a cellular memory that enables human gastruloid cells to respond to ACTIVIN as a morphogen, but ACTIVIN alone is insufficient to induce mesendodermal differentiation without prior WNT exposure.",PMC,6234031.0,False
30283134,2018,Multi-axial self-organization properties of mouse embryonic stem cells into gastruloids.,Leonardo … Martinez,Nature,mouse,mESC unspecified,not reported,not reported,not reported,not reported,not reported,not reported,not reported,not reported,unclear,not reported,not reported,not reported,not reported,unclear,N,gastrulation-like stimulation and elongation in vitro,"Small aggregates of mouse ESCs self-organize to generate post-occipital neural, mesodermal and endodermal derivatives with collinear Hox patterns along an antero-posterior axis, revealing an unanticipated self-organizing capacity.",abstract only,,False
30517924,2018,The Chick Caudolateral Epiblast Acts as a Permissive Niche for Generating Neuromesodermal Progenitor Behaviours.,Peter … Benjamin,"Cells, tissues, organs",mouse,mESC unspecified,not reported,not reported,not reported,not reported,not reported,not reported,not reported,TBXT,N,not reported,not reported,not reported,not reported,N,N,none / descriptive study,"ES cell-derived NMp-like cells and undifferentiated ES cells display similar potentials to generate neuromesodermal progenitor behaviour in vivo, while this competence is lost in the anterior portion of gastruloids.",abstract only,6469839.0,False
28951435,2017,Anteroposterior polarity and elongation in the absence of extra-embryonic tissues and of spatially localised signalling in gastruloids: mammalian embryonic organoids.,A … Martinez,"Development (Cambridge, England)",mouse,mESC unspecified,not reported,not reported,48,72,ESL medium,"48, 72, 120","confocal, widefield-fluorescence, live-imaging","AR8::mCherry, T/Bra::GFP, GATA6::H2B-Venus, IBRE4::Cerulean, miR-290-mCherry/mir-302-eGFP, Nodal::YFP, Sox17::GFP, TCF/LEF::mCherry, Sox1::GFP",Y,elongation,not reported,120,90,unclear,Y,CHIR99021 pulse 48-72h post-aggregation,"Gastruloids develop anteroposterior polarity and elongation characteristic of the embryonic tail domain in the absence of extra-embryonic tissues and spatially localized signaling, with Wnt/β-catenin signaling providing robustness to T/Bra expression polarization.",PMC,5702072.0,False
28292838,2017,Ethical issues in human organoid and gastruloid research.,Megan … Jeremy,"Development (Cambridge, England)",human,not reported,not reported,not reported,not reported,not reported,not reported,not reported,not reported,not reported,N,not reported,not reported,not reported,not reported,N,N,none / descriptive study,"Research involving human organoids and gastruloids involves ethical issues related to their derivation, maturation, and use, which are not specifically addressed by existing ethics oversight mechanisms.",abstract only,,False
28943028,2017,Engineering Ethics and Self-Organizing Models of Human Development: Opportunities and Challenges.,Insoo,Cell stem cell,human,not reported,not reported,not reported,not reported,not reported,not reported,not reported,not reported,not reported,N,not reported,not reported,not reported,not reported,N,N,none / descriptive study,"Incorporating engineering ethics early in organoid and gastruloid research planning may help clarify the moral status of complex developmental models, though the self-organizing nature of these systems poses challenges.",abstract only,,False
28292844,2017,"Embryoids, organoids and gastruloids: new approaches to understanding embryogenesis.",Mijo … H,"Development (Cambridge, England)",human,not reported,not reported,not reported,not reported,not reported,not reported,not reported,not reported,not reported,N,not reported,not reported,not reported,not reported,N,N,none / descriptive study,"Embryoids, organoids and gastruloids generated in vitro provide opportunities to explore complex embryological events in a detailed and quantitative manner.",abstract only,5358114.0,False
27746044,2016,A Balance between Secreted Inhibitors and Edge Sensing Controls Gastruloid Self-Organization.,Fred … D,Developmental cell,human,RUES2,not reported,not reported,not reported,not reported,HUESM,42,"confocal, widefield-fluorescence","pSMAD1, YAP/TAZ, ZO-1, WGA, BMPRIA, BMPRII, ActRIB, ActRIIB",N,not reported,not reported,not reported,not reported,N,N,BMP4 dose titration and cell density variation on micropatterned colonies,"Gastruloid self-organization is controlled by a combination of density-dependent receptor relocalization to the basolateral surface and BMP4-induced secretion of the Noggin inhibitor, which together create spatial restrictions in TGF-β signaling response.",PMC,5113147.0,False
27792143,2016,Self-Organization of Stem Cell Colonies and of Early Mammalian Embryos: Recent Experiments Shed New Light on the Role of Autonomy vs. External Instructions in Basic Body Plan Development.,Hans-Werner,Cells,human,not reported,not reported,not reported,not reported,not reported,not reported,not reported,not reported,not reported,N,not reported,not reported,not reported,not reported,N,N,none / descriptive study,Self-organization of gastruloids and early mammalian embryos in vitro demonstrates pattern formation and basic body plan development through mechanisms that involve autonomy versus external instructive signals.,abstract only,5187523.0,False
27825435,2016,"Signaling Boundary Conditions Drive Self-Organization of Human ""Gastruloids"".",Matthew,Developmental cell,human,not reported,not reported,not reported,not reported,not reported,not reported,not reported,not reported,not reported,not reported,not reported,not reported,not reported,not reported,not reported,not reported,none / descriptive study,"A confined colony of human embryonic stem cells can spontaneously sense its boundary, generating a self-organized TGF-β signaling gradient that patterns it into a tissue resembling a gastrulating embryo.",abstract only,,False
25371360,2014,"Symmetry breaking, germ layer specification and axial organisation in aggregates of mouse embryonic stem cells.",C … Alfonso,"Development (Cambridge, England)",mouse,E14-Tg2A,300,not reported,48,72,N2B27,120,"brightfield, confocal","Sox1-GFP, Sox17-GFP, Bra-GFP, TCF/LEF-mCherry, TBX6-EYFP, GPI-GFP, Bra, E-Cadherin, Sox17, FoxA2",Y,"elongation, polarisation",not reported,120,30,N,Y,N2B27 pre-treatment followed by Act/Chi signalling pulse timing and aggregate size optimization,"Aggregates of mESCs undergo symmetry breaking and polarization under defined culture conditions with optimal cell number (300±100 cells) and sequential exposure to N2B27 followed by activin A and CHIR99021, resulting in median 30% elongated gastruloids by day 4.",PMC,4302915.0,False
33303587,2020,Mouse embryonic stem cells self-organize into trunk-like structures with neural tube and somites.,V … G,"Science (New York, N.Y.)",mouse,mESC unspecified,not reported,not reported,not reported,not reported,not reported,not reported,not reported,not reported,unclear,not reported,not reported,not reported,not reported,unclear,N,"Tbx6 knockout, chemical modulation of somite formation",Mouse ESC aggregates self-organize into trunk-like structures with neural tube and somites that recapitulate post-implantation embryogenesis through similar gene-regulatory programs.,abstract only,,False
