pmid,year,title,first_last_authors,journal,species,cell_line,n_cells_per_aggregate,chir_uM,chir_onset_h,chir_offset_h,base_media,harvest_timepoints_h,imaging_modalities,fluorescent_reporters,morphology_quantified,morphology_metric,morphology_n,morphology_timepoint_h,elongation_pct,shape_distribution_figure,variability_addressed,key_perturbation,key_finding,full_text_source,pmcid,extraction_reviewed
37882990,2023,Spatial Single Cell Analysis of Proteins in 2D Human Gastruloids Using Iterative Immunofluorescence.,Emily … Idse,Current protocols,human,not reported,not reported,not reported,not reported,not reported,not reported,not reported,widefield-fluorescence,not reported,N,not reported,not reported,not reported,not reported,N,N,none / descriptive study,An iterative immunofluorescence protocol enables simultaneous measurement of over 27 proteins in 2D human gastruloids to interrogate spatial cell signaling and fate decisions during pattern formation.,abstract only,11132115.0,False
38095554,2023,Haematopoietic development and HSC formation in vitro: promise and limitations of gastruloid models.,Liza … Cristina,Emerging topics in life sciences,mammalian,not reported,not reported,not reported,not reported,not reported,not reported,not reported,not reported,not reported,N,not reported,not reported,not reported,not reported,N,N,none / descriptive study,Gastruloids are pluripotent stem cell-derived 3D aggregates that self-organise multi-tissue structures and hold potential for understanding haematopoietic stem cell specification and enabling HSC production in vitro.,abstract only,10754337.0,False
37514083,2023,Budesonide Analogues Preserve Stem Cell Pluripotency and Delay 3D Gastruloid Development.,Filomena … Cristina,Pharmaceutics,unspecified,not reported,not reported,not reported,not reported,not reported,not reported,not reported,not reported,not reported,not reported,not reported,not reported,not reported,not reported,not reported,not reported,budesonide and CHD-030498 analogue treatment,"CHD-030498, a budesonide analogue, prevents stem cell pluripotency exit and delays 3D gastruloid development at lower doses than budesonide.",abstract only,10383393.0,False
37590131,2023,Control of gastruloid patterning and morphogenesis by the Erk and Akt signaling pathways.,J … E,"Development (Cambridge, England)",mouse,not reported,not reported,not reported,not reported,not reported,not reported,not reported,not reported,not reported,unclear,not reported,not reported,not reported,not reported,unclear,N,Erk and Akt signaling pathway manipulation,"Erk and Akt signaling gradients control gastruloid patterning and morphogenesis, with Erk activation sufficient to induce tissue shape changes and convert gastruloids to mesodermal fates depending on anteroposterior position.",abstract only,11106667.0,False
38087891,2023,Stem cell-derived models of spinal neurulation.,Camil … Vanessa,Emerging topics in life sciences,both,not reported,not reported,not reported,not reported,not reported,not reported,not reported,not reported,not reported,not reported,not reported,not reported,not reported,not reported,not reported,not reported,not reported,"Recent in vitro models of human and mouse trunk morphogenesis, such as gastruloids, form spinal neural plate-like or neural tube-like structures and offer new avenues to study normal and pathological neurulation.",abstract only,,False
37897953,2023,Modifying gastruloids to dissect mechanisms of tissue-specific induction.,A … Jennifer,Current opinion in genetics & development,unspecified,not reported,not reported,not reported,not reported,not reported,not reported,not reported,not reported,not reported,N,not reported,not reported,not reported,not reported,N,N,none / descriptive study,"This is a review article exploring how minimal models including gastruloids can dissect mechanisms of tissue-specific induction and patterning, and whether self-organization can generate appendicular axes or if experimentally induced organizers are required.",abstract only,,False
37694611,2023,The people behind the papers - Christopher Cooke and Naomi Moris.,,"Development (Cambridge, England)",mouse,not reported,not reported,not reported,not reported,not reported,not reported,not reported,not reported,not reported,N,not reported,not reported,not reported,not reported,N,N,not reported,"A PGC-like cell population was identified in mouse gastruloids, providing new insight into signals contributing to PGC specification and maturation.",abstract only,,False
38054574,2023,Learning the mechanobiology of development from gastruloids.,Pierre-François … Sham,Emerging topics in life sciences,unspecified,not reported,not reported,not reported,not reported,not reported,not reported,not reported,not reported,not reported,N,not reported,not reported,not reported,not reported,N,N,none / descriptive study,"Gastruloids acquire their organization and shape through cell biochemical and mechanical activities, and mechanobiology concepts are essential to understanding gastruloid development.",abstract only,,False
37209681,2023,Multimodal characterization of murine gastruloid development.,Simon … Prisca,Cell stem cell,mouse,mESC unspecified,300,3,48,continuous,N2B27,"0, 36, 48, 56, 60, 72, 84, 96, 120","confocal, widefield-fluorescence","DAPI, pAKT2, ALK4, β-catenin, Brachyury, Cdx2, Dppa4, E-cadherin, EGFR, Fibronection, FoxA2, Gata6, Hes1, Ki67, N-cadherin, Nanog, Nestin, Oct3/4, Otx1/2, Otx2, p44/42 MAPK, Pax6, Phospho-p44/42 MAPK, Phospho Smad2, Sox1, Sox2, Tbr2/Eomes, Tuj1",Y,axial elongation,not reported,not reported,not reported,unclear,Y,Wnt activation via CHIR99021 pulse; high-content screen targeting symmetry breaking and patterning events; dual Wnt modulation,"Gastruloids exhibit spatial heterogeneity of pluripotency exit that causes binary response to Wnt activation, driving radial symmetry breaking, morphological changes, and axial elongation, with dual Wnt modulation enabling generation of gastruloids with anterior neural and endodermal structures.",PMC,10241222.0,False
37721864,2023,Generation of embryo-like structures from mouse embryonic stem cells treated with a chemical inhibitor of SUMOylation and cultured in microdroplets.,Tatiana … Jack-Christophe,STAR protocols,mouse,mESC unspecified,not reported,not reported,not reported,not reported,not reported,not reported,not reported,not reported,unclear,not reported,not reported,not reported,not reported,unclear,N,SUMOylation inhibitor treatment in microdroplets,Chemical inhibition of SUMOylation in mouse embryonic stem cells cultured in microdroplets generates highly reproducible gastruloids and embryo-like structures with anterior neural and trunk somite-like regions.,abstract only,10518363.0,False
38108463,2023,Gastruloids - a minimalistic model to study complex developmental metabolism.,Chaitanya … Ben,Emerging topics in life sciences,mammalian,not reported,not reported,not reported,not reported,not reported,not reported,not reported,not reported,not reported,N,not reported,not reported,not reported,not reported,N,N,none / descriptive study,Gastruloids are an ideal reductionist system to uncover mechanistic links between developmental signalling pathways and metabolic networks.,abstract only,10754324.0,False
37604096,2023,The ever-growing world of gastruloids: autogenous models of mammalian embryogenesis.,E … Dm,Current opinion in genetics & development,mammalian,not reported,not reported,not reported,not reported,not reported,not reported,not reported,not reported,not reported,N,not reported,not reported,not reported,not reported,N,N,none / descriptive study,"Gastruloids are tractable, scalable in vitro models of mammalian gastrulation that enable study of self-organisation, patterning and fate specification.",abstract only,,False
37686459,2023,In Vitro Embryogenesis and Gastrulation Using Stem Cells in Mice and Humans.,Yeon … Tae,International journal of molecular sciences,human,not reported,not reported,not reported,not reported,not reported,not reported,not reported,not reported,not reported,not reported,not reported,not reported,not reported,not reported,not reported,not reported,not reported,not reported,abstract only,10563085.0,False
37815089,2023,Gastruloid optimization.,Lara … Iftach,Emerging topics in life sciences,unspecified,not reported,not reported,not reported,not reported,not reported,not reported,not reported,not reported,not reported,N,not reported,not reported,not reported,not reported,N,Y,none / descriptive study,Robustness and reproducibility of gastruloids both within and between experiments are key to wide adoption for developmental modeling and drug screening applications.,PMC,10754328.0,False
36308705,2023,Gastruloids: A Novel System for Disease Modelling and Drug Testing.,Atoosa … Mubeen,Stem cell reviews and reports,mammalian,not reported,not reported,not reported,not reported,not reported,not reported,not reported,not reported,not reported,not reported,not reported,not reported,not reported,not reported,not reported,not reported,none / descriptive study,Gastruloids derived from pluripotent stem cells recapitulate key aspects of gastrula-stage embryos and provide a tractable in vitro tool suitable for high-throughput investigation of developmental and environmental aberrations.,abstract only,,False
35721464,2022,A combined human gastruloid model of cardiogenesis and neurogenesis.,T … L,iScience,human,H3.1.1,not reported,3,0,48,N2B27,"168, 384","brightfield, widefield-fluorescence, confocal","SOX2, GATA6, FOXA2, TUJ1, cTnT",Y,elongation,not reported,"120, 168",not reported,N,N,growth factor supplementation for cardiogenesis (VEGF and ascorbic acid addition at 48h post-aggregation),"Modified growth factor supplementation at 48 hours post-aggregation directs EMLO gastruloids toward cardiogenesis, generating elongated structures with chamber-like cavities, spontaneous contractility, and integrated neurogenesis by day 7.",PMC,9198845.0,False
34930826,2022,Circadian key component CLOCK/BMAL1 interferes with segmentation clock in mouse embryonic organoids.,Yasuhiro … Kazuhiro,Proceedings of the National Academy of Sciences of the United States of America,mouse,"KY1.1, E14TG2a, Per2 Luc",200-250,1,0,continuous,N2B27,96,"bioluminescence, live-imaging, in situ hybridization","Hes7-promoter-driven luciferase, Per2-luciferase, Uncx4.1 HCR probe",N,not reported,not reported,not reported,not reported,N,N,Doxycycline-inducible Clock/Bmal1 expression in gastruloids,Premature expression of circadian key components CLOCK/BMAL1 severely interferes with the ultradian rhythm of the segmentation clock in embryonic organoids and disrupts the striped structure of somite markers.,PMC,8746294.0,False
36102628,2022,"Hypoxia induces an early primitive streak signature, enhancing spontaneous elongation and lineage representation in gastruloids.",Natalia … Aydan,"Development (Cambridge, England)",mammalian,E14,not reported,not reported,0,120,DMEM/high glucose with Glutamax,120,"brightfield, widefield-fluorescence","NANOG, CDX2, GATA4",Y,elongation,not reported,120,50,unclear,Y,Hypoxia exposure (2% O2 vs 20% O2),"Hypoxia induces an early primitive streak signature, enhancing spontaneous elongation and improving lineage representation in gastruloids, particularly through enhanced endoderm formation and mesodermal derivatives.",PMC,9578691.0,False
35079017,2022,Nodal is a short-range morphogen with activity that spreads through a relay mechanism in human gastruloids.,Lizhong … Aryeh,Nature communications,human,ESI-017,not reported,not reported,not reported,not reported,mTeSR1,40,"widefield-fluorescence, live-imaging","cNodal-mCitrine, Lefty, BRA, SOX2, pSmad2/3, mCherry-CAAX, CFP-H2B",N,not reported,not reported,not reported,not reported,N,N,Nodal/Lefty knockout and juxtaposition experiments to determine Nodal signaling range,"Nodal is a short-range morphogen that does not spread more than one cell diameter and propagates through a transcriptional relay mechanism, while Lefty protein spreads over 6-8 cell tiers but functions at short range during gastruloid patterning.",PMC,8789905.0,False
35707767,2022,A gastruloid model of the interaction between embryonic and extra-embryonic cell types.,Mlp … Stefan,Journal of tissue engineering,mouse,E14,200,3,48,72,N2B27,96,"brightfield, widefield-fluorescence, confocal, light-sheet, live-imaging","Sox1-GFP, mCherry-GPI, eGFP, H2B-GFP",Y,"elongation, symmetry breaking",not reported,96,not reported,N,Y,"XEN cell co-aggregation with mESCs at varying ratios (1:1, 1:2, 1:3, 1:4, 1:5, 0:1); CHIR99021 GSK3 inhibition","Co-aggregation of mESCs with XEN cells (extraembryonic) cells at a 1:3 ratio induces the formation of organized neuroepithelial structures with columnar epithelia and lumina, whereas mESCs alone form disorganized SOX2-positive cells.",PMC,9189523.0,False
36306780,2022,Stabilization of cell-cell adhesions prevents symmetry breaking and locks in pluripotency in 3D gastruloids.,Federica … Gabriella,Stem cell reports,mouse,E14,250-600,not reported,not reported,not reported,N2B27,"48, 120","brightfield, confocal",BRACHYURY,Y,elongation index,24-30,120,not reported,Y,Y,budesonide treatment to inhibit symmetry breaking,"Budesonide, a glucocorticoid, prevents gastruloid elongation and locks cells in pluripotency by stabilizing E-CADHERIN-mediated cell-cell adhesions and blocking differentiation independently of glucocorticoid receptor signaling.",PMC,9669408.0,False
35537519,2022,Gastruloids: Pluripotent stem cell models of mammalian gastrulation and embryo engineering.,Martinez … Naomi,Developmental biology,both,not reported,not reported,not reported,not reported,not reported,not reported,not reported,not reported,not reported,N,not reported,not reported,not reported,not reported,N,N,none / descriptive study,"Gastruloids are ES cell aggregates that undergo controlled proliferation, symmetry breaking, and specification of all three germ layers, but reveal a disconnect between cell type specific gene expression and tissue morphogenesis.",abstract only,9477185.0,False
36214410,2022,Approaches to benchmark and characterize in vitro human model systems.,J … R,"Development (Cambridge, England)",human,not reported,not reported,not reported,not reported,not reported,not reported,not reported,not reported,not reported,N,not reported,not reported,not reported,not reported,N,N,none / descriptive study,"This Spotlight discusses the state of current in vitro model systems including gastruloids and organoids, efforts to create large publicly available atlases of developing human tissues, and how these data are being used to improve in vitro models.",abstract only,10906492.0,False
35486247,2022,Generation of Gastruloids from Epiblast-Like Cells.,Federica … Gabriella,"Methods in molecular biology (Clifton, N.J.)",mouse,mESC unspecified,not reported,not reported,not reported,not reported,not reported,not reported,not reported,not reported,N,not reported,not reported,not reported,not reported,N,N,none / descriptive study,"Gastruloids can be generated from epiblast-like cells induced from ESCs, and gastruloid formation efficiency discriminates different states of mouse pluripotency.",abstract only,,False
35927563,2022,Gastruloids as in vitro models of embryonic blood development with spatial and temporal resolution.,Giuliana … P,Scientific reports,mouse,"Sox1-GFP::Brachyury-mCherry, Flk1-GFP, Gata6-Venus",not reported,not reported,not reported,not reported,not reported,"96, 120, 144, 168",not reported,"Sox1-GFP, Brachyury-mCherry, Flk1-GFP, Gata6-Venus",N,not reported,not reported,not reported,not reported,N,Y,"VEGF, bFGF, and ascorbic acid supplementation to support hematopoietic development","Gastruloids express key hematopoiesis-related genes in a temporally relevant fashion that recapitulates embryonic blood development, with CD41+ blood progenitor cells emerging in close proximity to the vascular network and endodermal compartment, and showing multipotent clonogenic potential and embryonic hemoglobin expression.",PMC,9352713.0,False
35883568,2022,Capturing Transitional Pluripotency through Proline Metabolism.,Gabriella … Jorge,Cells,mouse,mESC unspecified,not reported,not reported,not reported,not reported,not reported,not reported,not reported,not reported,N,not reported,not reported,not reported,not reported,N,N,proline metabolism imbalance,Proline-induced cells represent a metastable naïve-to-primed intermediate pluripotency state with reversible E-cadherin relocalization and capacity for 3D gastruloid development.,abstract only,9323356.0,False
36326003,2022,Chimeric 3D gastruloids - a versatile tool for studies of mammalian peri-gastrulation development.,E … J,"Development (Cambridge, England)",mouse,mESC unspecified,not reported,not reported,not reported,not reported,not reported,not reported,not reported,not reported,N,not reported,not reported,not reported,not reported,N,N,chimeric gastruloids with Tbx brachyury deletion and inducible Eomes expression,"Chimeric gastruloids combining fluorescently labelled cells of different genotypes reveal brachyury and Eomes functions including cardiac fate instruction, posterior axial extension, tissue sorting preferences of mutant cells, and cell non-autonomous effects on Wnt3a patterning.",abstract only,,False
35974701,2022,Human stem cell-derived neurons and neural circuitry therapeutics: Next frontier in spinal cord injury repair.,Belen … L,"Experimental biology and medicine (Maywood, N.J.)",human,not reported,not reported,not reported,not reported,not reported,not reported,not reported,not reported,not reported,N,not reported,not reported,not reported,not reported,N,N,none / descriptive study,"NMP-derived spinal motor neurons generated from hiPSCs demonstrate robust survival when transplanted into spinal cord injury sites, and in vitro gastruloid models are advancing as tools for studying trunk nervous system integration.",abstract only,9837306.0,False
35404233,2022,Cell-state transitions and collective cell movement generate an endoderm-like region in gastruloids.,Ali … Pierre-François,eLife,mouse,E14Tg2a.4,50-60,not reported,48,72,N2B27,"48, 72, 92, 96, 100","brightfield, widefield-fluorescence, confocal, light-sheet, live-imaging","E-cadherin-GFP, Oct4-mCherry, T-Bra-GFP, NE-mKate2",Y,elongation ratio,37,96,80,Y,Y,CHIR99021 (Wnt agonist) pulse for 24 hours starting at 48 hours post-plating,"Chiron-exposed gastruloids develop polarized E-cadherin and T-Brachyury expression at one pole, with E-cadherin-positive cells segregating to form an endoderm-like region through coordinated cell movements and state transitions, distinct from mesoderm-like T-Bra-expressing cells.",PMC,9033300.0,False
35063126,2022,YAP1 regulates the self-organized fate patterning of hESC-derived gastruloids.,Eleonora … Conchi,Stem cell reports,human,H1,not reported,not reported,not reported,not reported,mTeSR1,48,widefield-fluorescence,"SOX2, OTX2, BRACHYURY, SOX17, OCT4, CDX2, YAP1",N,not reported,not reported,not reported,not reported,N,N,YAP1 knockout,YAP1 regulates the correct specification and allocation of the three germinal layers in hESC-derived 2D gastruloids by restricting Nodal signaling.,PMC,8828531.0,False
34974300,2022,SEPHS1 is dispensable for pluripotency maintenance but indispensable for cardiac differentiation in mouse embryonic stem cells.,Lu … Kyun,Biochemical and biophysical research communications,mouse,mESC unspecified,not reported,not reported,not reported,not reported,not reported,240,not reported,not reported,N,not reported,not reported,not reported,not reported,N,N,SEPHS1 knockout,"SEPHS1 deficiency impaired gastruloid aggregation and differentiation into germ layers, particularly affecting cardiac lineage development, while having little effect on pluripotency maintenance.",abstract only,,False
35880022,2022,An automated do-it-yourself system for dynamic stem cell and organoid culture in standard multi-well plates.,Julia … J,Cell reports methods,mouse,SBr (Sox1-GFP: Brachyury-mCherry reporter ESCs),300,3,48,not reported,N2B27,"120, 168","brightfield, widefield-fluorescence, live-imaging","Sox1-GFP, Brachyury-mCherry, cardiac troponin T",Y,elongation,not reported,120,not reported,unclear,Y,CHIR99021 pulse duration titration (varying Wnt pathway activation timing),"Minimum 24-hour CHIR pulse is required and sufficient to induce robust symmetry breaking and gastruloid elongation, with extended Wnt pathway activation correlating with enhanced mesodermal differentiation including cardiac tissue formation.",PMC,9308133.0,False
36595961,2022,Generation of human elongating multi-lineage organized cardiac gastruloids.,T … L,STAR protocols,human,not reported,not reported,not reported,not reported,not reported,not reported,not reported,not reported,not reported,unclear,not reported,not reported,not reported,not reported,unclear,N,"FGF2, HGF, IGF1, Y-27632 signaling with cardiogenic factors (FGF2, VEGF, ascorbic acid)",Human elongating multi-lineage organized (EMLOC) gastruloids with integrated neurons and multi-chambered contractile cardiac tissue can be generated using timed exposure to defined signaling factors.,abstract only,9727145.0,False
34200796,2021,"Autonomy in the Development of Stem Cell-Derived Embryoids: Sprouting Blastocyst-Like Cysts, and Ethical Implications.",Hans-Werner,Cells,both,not reported,not reported,not reported,not reported,not reported,not reported,not reported,not reported,not reported,N,not reported,not reported,not reported,not reported,N,N,none / descriptive study,Ethical aspects of organismic wholeness and autonomy in stem cell-derived embryoids warrant greater attention in regulatory discussions regarding this technology.,abstract only,8230544.0,False
33891872,2021,Gastruloids generated without exogenous Wnt activation develop anterior neural tissues.,U … P,Stem cell reports,mouse,"SBr, WNT, TGF-β","25, 100",not reported,not reported,not reported,N2B27,"72, 78, 96, 120, 144, 168","brightfield, confocal, live-imaging","SOX1-GFP, T/BRA-mCherry, TLC-mCherry, AR8-mCherry, SOX2, NANOG, OCT4, SOX17",Y,"diameter, elongation","312, 335, 315, 316, 25, 29","72, 78",not reported,Y,Y,WNT inhibition with XAV939 vs. no inhibition; cell number per aggregate (25 vs. 100 cells/well),"Gastruloids generated without exogenous Wnt activation in EPI medium develop anterior neural tissues (forebrain, midbrain, hindbrain) when WNT signaling is inhibited early with XAV939, contrasting with conventional gastruloids that primarily form mesendodermal tissues.",PMC,8185432.0,False
34548640,2021,Author Correction: Depletion of aneuploid cells in human embryos and gastruloids.,Min … Norbert,Nature cell biology,human,not reported,not reported,not reported,not reported,not reported,not reported,not reported,not reported,not reported,unclear,not reported,not reported,not reported,not reported,unclear,not reported,not reported,not reported,abstract only,,False
33347872,2021,Modeling mammalian trunk development in a dish.,V … G,Developmental biology,mammalian,not reported,not reported,not reported,not reported,not reported,not reported,not reported,not reported,not reported,N,not reported,not reported,not reported,not reported,N,N,none / descriptive study,"Embedding of gastruloids in Matrigel enables self-organization into trunk-like structures with bilateral somites, neural tube-like structure, gut tissue, and primordial germ cell-like cells.",abstract only,,False
34940533,2021,Cardiac Organoids and Gastruloids to Study Physio-Pathological Heart Development.,E … Michel,Journal of cardiovascular development and disease,human,not reported,not reported,not reported,not reported,not reported,not reported,not reported,not reported,not reported,not reported,not reported,not reported,not reported,not reported,not reported,not reported,not reported,not reported,abstract only,8709242.0,False
33414560,2021,Mouse gastruloids take heart.,Deepak … C,Nature reviews. Cardiology,mouse,not reported,not reported,not reported,not reported,not reported,not reported,not reported,not reported,not reported,not reported,not reported,not reported,not reported,not reported,not reported,not reported,not reported,not reported,abstract only,,False
33340359,2021,Gastruloids: Embryonic Organoids from Mouse Embryonic Stem Cells to Study Patterning and Development in Early Mammalian Embryos.,Kerim … Vikas,"Methods in molecular biology (Clifton, N.J.)",mouse,mESC unspecified,not reported,not reported,not reported,not reported,not reported,not reported,not reported,not reported,N,not reported,not reported,not reported,not reported,N,Y,none / descriptive study,"Gastruloids are embryonic organoids from mESCs that display distinct, well-organized gene expression domains and axial elongation over 5-7 days, representing a useful system for studying early developmental patterning mechanisms.",abstract only,,False
34019395,2021,Bioengineering Self-Organizing Signaling Centers to Control Embryoid Body Pattern Elaboration.,Fokion … A,ACS synthetic biology,mouse,not reported,not reported,not reported,not reported,not reported,not reported,not reported,not reported,not reported,unclear,not reported,not reported,not reported,not reported,not reported,N,WNT3A provision via engineered HEK-293 cells,Synthetic biology approach using Cdh3-expressing HEK cells producing WNT3A induces localized mesoderm specification and pattern elaboration in embryoid bodies through polarized Wnt/β-catenin pathway activation.,abstract only,,False
