year,title,authors,journal,species,gene_pathways,phenotypes,genes_found,abstract,doi,pmid,mesh,pmcid
2025,Fine-tuning mechanical constraints reveals uncoupled patterning and gene expression programs in murine gastruloids.,"Pineau Judith, Wong-Ng Jerome, Mayran Alexandre, Lopez-Delisle Lucille, Osteil Pierre, Shoushtarizadeh Armin, Duboule Denis, Gobaa Samy, Gregor Thomas","Development (Cambridge, England)",mouse,,AP axis / symmetry breaking; Elongation; Germ layer specification,,"The interplay between mechanical forces and genetic programs is fundamental to embryonic development, yet how these factors influence morphogenesis and cell fate decisions remains unclear. Here, we fine-tune the mechanical environment of murine gastruloids, three-dimensional in vitro models of early embryogenesis, by embedding them in bioinert hydrogels with tunable stiffness and timing. This strategy reveals that external constraints can selectively influence transcriptional profiles, patterning or morphology, depending on the level and timing of mechanical modulation. Gastruloids in ultra-soft hydrogels (<30 Pa) elongate robustly, preserving anteroposterior patterning and transcriptional profiles. In contrast, embedding at higher stiffness disrupts polarization while leaving gene expression largely unaffected. Conversely, earlier embedding significantly impacts transcriptional profiles independently of polarization defects, highlighting the uncoupling of patterning and transcription. These findings suggest that distinct cellular states respond differently to external constraints. Live imaging and cell tracking further suggest that impaired cell motility underlies polarization defects, underscoring the role of mechanical forces in shaping morphogenesis independently of transcriptional changes. By precisely controlling mechanical boundaries, our approach provides a powerful platform to dissect how physical and biochemical factors interact to orchestrate embryonic development.",10.1242/dev.204711,41020403,"Animals; Mice; Gene Expression Regulation, Developmental; Body Patterning; Gastrula; Morphogenesis; Hydrogels; Embryonic Development; Organoids; Cell Movement; Cell Polarity",12516319.0
2025,N2B27 media formulations influence gastruloid development.,"Balayo Tina, Lunn Sharna, Pascual-Mas Pau, Fiuza Ulla-Maj, Vasudevan Amruta, Frenster Joshua D, Josende García Joel B, Galloon Hannah Y, Peirats Raquel Flores, Arias Alfonso Martinez, Dias André, Turner David A","Development (Cambridge, England)",mouse,,Elongation; Primitive streak / mesoderm induction; Germ layer specification,,"Gastruloids are 3D aggregates of pluripotent stem cells grown in suspension culture that mimic many aspects of gastrulation and early axial elongation. The N2B27 basal medium in which mouse gastruloids are cultured can either be home-made (HM-N2B27) with materials of known origin, or commercially sourced (NDiff227), where the exact formulation is unknown. In this study, we examined whether these formulations resulted in significant differences in gastruloid development. Our results reveal that while both media enable standard gastruloid elongation, HM-N2B27 gastruloids initiate the elongation process earlier, have a higher number of cells and an increased anterior domain. Despite the maintenance of overall gene expression patterns, RNAseq analysis indicated differences in cell fate specification, with HM-N2B27 gastruloids exhibiting higher expression of spinal cord-related genes, while NDiff227 favours mesodermal differentiation. Furthermore, differential gene enrichment analysis suggests that changes in key signalling pathways underlie the differences between HM-N2B27 and NDiff227 gastruloids. These findings highlight the importance of basal media composition for gastruloid development, underscoring the need for careful media selection during in vitro engineering of stem cell-based embryo models.",10.1242/dev.204774,41287934,"Animals; Mice; Gastrulation; Culture Media; Organoids; Cell Differentiation; Gastrula; Gene Expression Regulation, Developmental; Pluripotent Stem Cells; Cell Culture Techniques",12687332.0
2025,Morphogenetic constraints in the development of gastruloids: Implications for mouse gastrulation.,"Fiuza Ulla-Maj, Bonavia Sara, Pascual-Mas Pau, Torregrosa-Cortés Gabriel, Casaní-Galdón Pablo, Robertson Gaëlle, Dias André, Martinez Arias Alfonso",Cells & development,mouse,Nodal,AP axis / symmetry breaking; Elongation; Primitive streak / mesoderm induction; Self-organization,nodal,"Mammalian embryonic size is tightly controlled with checkpoints and compensatory mechanisms correcting size defects. Here, we take advantage of gastruloids, a stem cell embryoid system not subject to most size controls, to study the role of size in emergent properties of mammalian embryogenesis. We report that gastruloids exhibit robust morphology and transcriptional profiles within a size range. However, size affects the dynamics, and, outside a range of robust morphogenesis, the precision of anterior-posterior (AP) axial elongation. Gastruloid axial elongation exhibits active cellular contractility, requires planar cell polarity (PCP), adhesion and cell-cell contact remodelling. Smaller gastruloids initiate elongation earlier, correlated with an earlier Brachyury polarisation. Brachyury expression increases tissue fluidity. Axis formation is regulated by the balance of Brachyury multifoci coalescence and the timing of initiation of the elongation programme. Sizes beyond the robust range can modify relative tissue composition. Very small aggregates have increased neural fate bias, accompanied by a loss of paraxial mesoderm mediated by differences in Nodal signalling activity.",10.1016/j.cdev.2025.204043,40848835,"Animals; Gastrulation; Mice; T-Box Domain Proteins; Morphogenesis; Brachyury Protein; Cell Polarity; Organoids; Fetal Proteins; Gene Expression Regulation, Developmental; Mesoderm; Signal Transduction",
2025,Optimization of Gastruloid Pre-culture Conditions for Reproducible Germ Layer Composition.,"Blotenburg Marloes, Esin Beril, Buddharaju Shruthi, Zeller Peter","Methods in molecular biology (Clifton, N.J.)",mouse,,Primitive streak / mesoderm induction; Germ layer specification; Experimental variability / robustness,,"Gastruloids are an in vitro model that mimics key aspects of gastrulation and can be used to study implantation-stage embryonic development. Even though current protocols have contributed significantly to our understanding of developmental biology, further improvements in terms of consistency and reproducibility are still required. In this chapter, we present a detailed pre-culture protocol optimized for the generation of gastruloids from 129S1/SvImJ/ C57BL/6 mouse embryonic stem cells (mESCs). Additionally, we provide information on the steps of the protocol open to optimization and present a workflow for selecting optimal conditions and evaluating the gastruloid formation outcome when using different cell lines. Overall, this workflow facilitates a step-by-step approach toward generating gastruloids from any cell line in a highly reproducible manner by optimizing the mESC pre-culture conditions.",10.1007/7651_2025_667,41071232,,
2025,Single-cell spatial mapping reveals reproducible cell type organization and spatially-dependent gene expression in gastruloids.,"Triandafillou Catherine G, Sompalle Pranav, Heyman Yael, Raj Arjun",bioRxiv : the preprint server for biology,unspecified,Nodal,AP axis / symmetry breaking; Primitive streak / mesoderm induction; Germ layer specification; Experimental variability / robustness,cripto,"Gastruloids are three-dimensional stem-cell-based models that recapitulate key aspects of mammalian gastrulation, including formation of an anterior-posterior (AP) axis. However, we do not have detailed spatial information about gene expression and cell type organization, particularly at the level of individual gastruloids. Here, we report a spatially resolved, single-cell molecular catalog of the transcriptomes of 26 individual gastruloids. We found that cell type composition and spatial organization were remarkably consistent across gastruloids. Posterior cell types formed distinct, organized clusters, while anterior cell types were more disorganized. To distinguish progressive differentiation from cell type differences, we developed the L-metric, a parameter-free quantification of mutually exclusive gene expression. This analysis revealed spatial organization without explicit encoding, recapitulated known cell type relationships, and identified novel gene expression states and spatial subclusters within cell types. We confirmed that in gastruloids, NMP differentiation occurred through a continuous, spatially-coordinated process. We also showed that endothelial precursors exhibited unique spatial organization and had distinct gene expression profiles dependent on their association with anterior somitic or posterior endodermal tissues. This work enables the rigorous use of gastruloids as models for studying the molecular mechanisms underlying mammalian development and tissue organization, and introduces novel computational tools for analyzing spatially-resolved single-cell datasets.",10.1101/2025.07.14.664617,40766620,,12324194.0
2025,In preprints: gastruloids get (a)head.,"Brouwer Wilhelmus A, Braccioli Luca","Development (Cambridge, England)",unspecified,,,,,10.1242/dev.205199,40952017,,
2025,The emergence of human primordial germ cell-like cells in stem cell-derived gastruloids.,"Neupane Jitesh, Lubatti Gabriele, Gross-Thebing Theresa, Ruiz Tejada Segura Mayra Luisa, Butler Richard, Gross-Thebing Sargon, Dietmann Sabine, Scialdone Antonio, Surani M Azim",Science advances,human,Nodal; BMP,Primitive streak / mesoderm induction; Self-organization,bmp signaling; bmp2; cripto,"Most advances in early human postimplantation development depend on animal studies and stem cell-based embryo models. Here, we present self-organized three-dimensional human gastruloids (hGs) derived from embryonic stem cells. The transcriptome profile of day 3 hGs aligned with Carnegie stage 7 human gastrula, with cell types and differentiation trajectories consistent with human gastrulation. Notably, we observed the emergence of nascent primordial germ cell-like cells (PGCLCs), but without exogenous bone morphogenetic protein (BMP) signaling, which is essential for the PGCLC fate. A mutation in the <i>ISL1</i> gene affects amnion-like cells and leads to a loss of PGCLCs; the addition of exogenous BMP2 rescues the PGCLC fate, indicating that the amnion may provide endogenous BMP signaling. Our model of early human embryogenesis will enable further exploration of the germ line and other early human lineages.",10.1126/sciadv.ado1350,40138398,"Humans; Germ Cells; Cell Differentiation; Gastrula; Signal Transduction; Organoids; Embryonic Stem Cells; Transcriptome; Gastrulation; Human Embryonic Stem Cells; Embryonic Development; Transcription Factors; Gene Expression Regulation, Developmental; Bone Morphogenetic Proteins",11939039.0
2025,Signaling switches: Metabolism regulates gastruloid self-organization.,"Rodríguez Colman María J, Sonnen Katharina F",Cell stem cell,mouse,,Germ layer specification; Self-organization,,"Metabolic regulation of embryonic development is increasingly recognized. Villaronga-Luque et al.<sup>1</sup> and Stopornwongkul et al.<sup>2</sup> show that metabolic activity influences gastruloid formation from mouse embryonic stem cells, revealing that the balance between glycolysis and oxidative phosphorylation regulates cell fate decisions during gastruloid self-organization.",10.1016/j.stem.2025.04.005,40315829,Animals; Mice; Signal Transduction; Glycolysis; Organoids; Oxidative Phosphorylation; Mouse Embryonic Stem Cells,
2025,Establishment of human gastrulating stem cells with the capacity of stable differentiation into multiple gastrulating cell types.,"Huang Mingqian, Chen Mengqi, Yuan Gege, Cui Yiqiang, Shen Bin, Liu Zhaode, Zhang Bohang, Chen Junqing, Chen Dingdong, Qiu Shuangshuang, Zhang Yichun, Liu Li, Qin Lianju, Zhu Yunfei, Liu Jiayin, Zhang Hao, Wu Jun, Yuan Yan, Sha Jiahao",Cell research,human,,Primitive streak / mesoderm induction; Germ layer specification; Self-organization,,"Pluripotent stem cells (PSCs) have been derived from various species, but most culture systems stabilize only a single PSC type. By contrast, epiblast cells in vivo exist along a continuum and interact dynamically with both embryonic and extraembryonic cells, interactions missing in standard PSC cultures. This absence limits the self-organizing potential of PSCs and leads to disorganized tissue formation in teratomas. To address this, we developed a unified culture system that supports the stable differentiation of epiblast-like cells into multiple key human gastrulating cell types, collectively called human gastrulating stem cells (hGaSCs). hGaSCs, composed of endoderm-like, mesoderm-like, ectoderm-like, amnion ectoderm-like, and primordial germ cell-like cells, maintain a stable balance during long-term culture. In 3D culture, hGaSCs self-assemble into gastruloid-like structures (hGaSC-gastruloids) that model aspects of a Carnegie Stage 7 human embryo, including gastrulation and germ layer specification. Using hGaSC-gastruloids, we modeled the effects of valproic acid (VPA) on human gastrulation and uncovered molecular pathways underlying VPA-induced malformations. When transplanted into the seminiferous tubules, hGaSCs formed embryo-like structures, progressing through fetal tissue and organ development, unlike the disorganized growth seen in teratomas. In conclusion, hGaSCs provide a versatile platform to study human gastrulation, early organogenesis, developmental defects, and drug teratogenicity, with promising applications in tissue and organ generation from cultured stem cells.",10.1038/s41422-025-01146-z,40770543,"Humans; Cell Differentiation; Gastrulation; Germ Layers; Animals; Valproic Acid; Pluripotent Stem Cells; Mice; Cells, Cultured; Cell Culture Techniques",
2025,An Optimized Protocol for the Extended Culture of Gastruloids from Mouse Embryonic Stem Cells.,"Blotenburg Marloes, Buddharaju Shruthi, Esin Beril, Zeller Peter","Methods in molecular biology (Clifton, N.J.)",mouse,,Primitive streak / mesoderm induction; Germ layer specification; Experimental variability / robustness,,"Gastruloids are three-dimensional aggregates, derived from mouse embryonic stem cells, that recapitulate key events of early embryogenesis. Protocols to generate gastruloids are highly sensitive to aggregation conditions, often resulting in variability. Here, we present an optimized method for generating gastruloids and extending their culture up to 168 h post-aggregation by embedding them in 10% Matrigel at 96 h. This protocol enables reproducible generation of gastruloids with derivatives of all three germ layers, providing an extended experimental window to study post-gastrulation developmental processes in vitro.",10.1007/7651_2025_666,40973928,,
2025,Exploring and validating the marmoset as a primate model for chromosomal instability in early development.,"Cearlock Andrew, Mysliwiec Hubert, Agarsheva Margarita, Krzyspiak Joanna, Ozair Mohammad Zeeshan, Brivanlou Ali H, Yang Min",Molecular human reproduction,human,Nodal,Primitive streak / mesoderm induction; Germ layer specification,cripto,"Aneuploidy in embryos poses a major barrier to successful human reproduction, contributing to nearly 50% of early miscarriages. Despite its high prevalence in human embryos, the molecular mechanisms regulating aneuploid cell fate during development remain poorly understood. This knowledge gap persists due to ethical constraints in human embryo research and the limitations of existing animal models. In this study, we identified the New World primate marmoset (Callithrix jacchus) as a suitable model for investigating aneuploidy. By calling copy number variants from single-cell RNA-sequencing data of marmoset embryonic cells, we identified heterogeneous aneuploidy, indicating chromosomal instability (CIN) in marmoset preimplantation embryos. Furthermore, marmoset aneuploidy displayed lineage-specific behavior during gastruloid differentiation, similar to humans, suggesting a conserved regulatory mechanism in lineage specification. To develop a more pluripotent cell line to study early specification, we established an efficient approach for generating naïve-like marmoset pluripotent stem cells (cjPSCs). These cells resemble preimplantation epiblast-like cells and exhibit inherent CIN. Transcriptome analysis identified potential pathways contributing to aneuploidy during early embryogenesis, including the downregulation of cell cycle checkpoint signaling and the upregulation of autophagy pathways. Additionally, we found no significant effect of spontaneously occurring aneuploidy in cjPSCs on blastoid formation, suggesting that the consequences of aneuploidy become evident only after gastrulation, with preimplantation lineages exhibiting a higher tolerance for genomic instability. Unexpectedly, aneuploidy enhanced cavity formation during blastoid development, suggesting a potential role in facilitating efficient trophectoderm differentiation. Our findings validate the marmoset as a valuable model for studying CIN during early primate development and provide insight into the mechanisms underlying the prevalence of aneuploidy in primates. Naïve-like cjPSCs recapitulate key phenotypic traits of early embryonic cells, providing a robust system for studying post-implantation aneuploid cell fates in vivo and serving as a foundation for future research in this field.",10.1093/molehr/gaaf012,40193493,"Animals; Callithrix; Chromosomal Instability; Aneuploidy; Embryonic Development; Female; Cell Differentiation; Blastocyst; Pluripotent Stem Cells; Models, Animal",13032081.0
2025,Cadherins modulate the self-organizing potential of pseudo-embryos.,"Mayran Alexandre, Kolly Dominique, Lopez-Delisle Lucille, Romaniuk Yuliia, Leonardi Maxine, Cossy Anne-Catherine, Lacroix Theo, Rekaik Hocine, Amândio Ana Rita, Osteil Pierre, Duboule Denis",Cell reports,mammalian,,Primitive streak / mesoderm induction; Self-organization,,"Embryonic stem cells can be instructed to form gastruloids, an efficient four-dimensional model for studying some aspects of post-implantation embryonic patterning, which undergo gastrulation-like processes, illustrating their robust self-organizing capacity to form embryo-like patterns. Here, we study the molecular and cellular mechanisms underlying this remarkable property and report that self-organization competence is associated with a cell-specific coordination of a cadherin switch. E-cadherin repression by Snai1 is indeed critical for this process, with Snai1 triggering the cell-specific pace of pluripotency exit, thus allowing a coordinated transition from E- to N-cadherin to occur. In contrast, we find that N-cadherin inactivation unleashes gastruloids' morphogenetic competence, for it leads to the formation of embryo-like structures with proper rostro-caudal somite patterning without requiring any addition of extracellular matrix. Altogether, this work establishes a molecular mechanism that integrates the exit from pluripotency and the pace of cell differentiation, leading to the self-organizing potential of gastruloids.",10.1016/j.celrep.2025.116567,41241940,Animals; Cadherins; Gastrulation; Cell Differentiation; Body Patterning; Mice; Snail Family Transcription Factors; Pluripotent Stem Cells; Embryonic Stem Cells,
2025,Towards an integrated view and understanding of embryonic signalling during murine gastrulation.,"Haantjes Rhanna R, Strik Jeske, de Visser Joëlle, Postma Marten, van Amerongen Renée, van Boxtel Antonius L",Cells & development,mouse,Wnt; Nodal,Primitive streak / mesoderm induction; Germ layer specification,nodal; wnt,"At the onset of mammalian gastrulation, secreted signalling molecules belonging to the Bmp, Wnt, Nodal and Fgf signalling pathways induce and pattern the primitive streak, marking the start for the cellular rearrangements that generate the body plan. Our current understanding of how signalling specifies and organises the germ layers in three dimensions, was mainly derived from genetic experimentation using mouse embryos performed over many decades. However, the exact spatiotemporal sequence of events is still poorly understood, both because of a lack of tractable models that allow for real time visualisation of signalling and differentiation and because of the molecular and cellular complexity of these early developmental events. In recent years, a new wave of in vitro embryo models has begun to shed light on the dynamics of signalling during primitive streak formation. Here we discuss the similarities and differences between a widely adopted mouse embryo model, termed gastruloids, and real embryos from a signalling perspective. We focus on the gene regulatory networks that underlie signalling pathway interactions and outline some of the challenges ahead. Finally, we provide a perspective on how embryo models may be used to advance our understanding of signalling dynamics through computational modelling.",10.1016/j.cdev.2025.204028,40316255,"Animals; Gastrulation; Mice; Signal Transduction; Embryo, Mammalian; Gene Expression Regulation, Developmental; Gene Regulatory Networks",
2024,Complex aneuploidy triggers autophagy and p53-mediated apoptosis and impairs the second lineage segregation in human preimplantation embryos.,"Regin Marius, Lei Yingnan, Couvreu De Deckersberg Edouard, Janssens Charlotte, Huyghebaert Anfien, Guns Yves, Verdyck Pieter, Verheyen Greta, Van de Velde Hilde, Sermon Karen, Spits Claudia",eLife,both,,Germ layer specification,,"About 70% of human cleavage stage embryos show chromosomal mosaicism, falling to 20% in blastocysts. Chromosomally mosaic human blastocysts can implant and lead to healthy new-borns with normal karyotypes. Studies in mouse embryos and human gastruloids showed that aneuploid cells are eliminated from the epiblast by p53-mediated apoptosis while being tolerated in the trophectoderm. These observations suggest a selective loss of aneuploid cells from human embryos, but the underlying mechanisms are not yet fully understood. Here, we investigated the cellular consequences of aneuploidy in a total of 125 human blastocysts. RNA-sequencing of trophectoderm cells showed activated p53 pathway and apoptosis proportionate to the level of chromosomal imbalance. Immunostaining corroborated that aneuploidy triggers proteotoxic stress, autophagy, p53-signaling, and apoptosis independent from DNA damage. Total cell numbers were lower in aneuploid embryos, due to a decline both in trophectoderm and in epiblast/primitive endoderm cell numbers. While lower cell numbers in trophectoderm may be attributed to apoptosis, aneuploidy impaired the second lineage segregation, particularly primitive endoderm formation. This might be reinforced by retention of NANOG. Our findings might explain why fully aneuploid embryos fail to further develop and we hypothesize that the same mechanisms lead to the removal of aneuploid cells from mosaic embryos.",10.7554/eLife.88916,39652462,Aneuploidy; Humans; Blastocyst; Apoptosis; Tumor Suppressor Protein p53; Autophagy; Cell Lineage; Female; Nanog Homeobox Protein,11627504.0
2024,Embryonic Spinal Cord Innervation in Human Trunk Organogenesis Gastruloids: Cardiac Versus Enteric Customization and Beyond.,"Olmsted Zachary T, Paredes-Espinosa Maria Belen, Paluh Janet L","Methods in molecular biology (Clifton, N.J.)",human,,Elongation; Germ layer specification; Self-organization,,"Trunk-biased human gastruloids provide the ability to couple developmentally relevant spinal neurogenesis and organ morphogenesis via spatiotemporal self-organization events from derivatives of the three germ layers. The multi-lineage nature of gastruloids provides the full complexity of regulatory signaling cues that surpasses directed organoids and lays the foundation for an ex vivo self-evolving system. Here we detail two distinct protocols for trunk-biased gastruloids from an elongated, polarized structure with coordinated organ-specific neural patterning. Following an induction phase to caudalize iPSCs to trunk phenotype, divergent features of organogenesis and end-organ innervation yield separate models of enteric and cardiac nervous system formation. Both protocols are permissive to multi-lineage development and allow the study of neural integration events within a native, embryo-like context. We discuss the customizability of human gastruloids and the optimization of initial and extended conditions that maintain a permissive environment for multi-lineage differentiation and integration.",10.1007/7651_2023_491,37284941,Humans; Gastrula; Organogenesis; Signal Transduction; Organoids; Spinal Cord,
