year,title,authors,journal,species,gene_pathways,phenotypes,genes_found,abstract,doi,pmid,mesh,pmcid
2021,"In vitro teratogenicity testing using a 3D, embryo-like gastruloid system.","Mantziou Veronika, Baillie-Benson Peter, Jaklin Manuela, Kustermann Stefan, Arias Alfonso Martínez, Moris Naomi","Reproductive toxicology (Elmsford, N.Y.)",both,,Elongation; Primitive streak / mesoderm induction; Germ layer specification,,"Pharmaceuticals intended for use in patients of childbearing potential need to be tested for teratogenicity before marketing. Several pharmaceutical companies use animal-free in vitro models which allow a more rapid selection of lead compounds and contribute to 3Rs principles ('replace, reduce and refine') by streamlining the selection of promising compounds submitted to further regulatory studies in animals. Currently available in vitro models typically rely on adherent monolayer cultures or disorganized 3D structures, both of which lack the spatiotemporal and morphological context of the developing embryo. A newly developed 3D 'gastruloid' model has the potential to achieve a more reliable prediction of teratogenicity by providing a robust recapitulation of gastrulation-like events alongside morphological coordination at relatively high-throughput. In this first proof-of-concept study, we used both mouse and human gastruloids to examine a panel of seven reference compounds, with associated in vivo data and known teratogenic risk, to quantitatively assess in vitro teratogenicity. We observed several gross morphological effects, including significantly reduced elongation or decreased size of the gastruloids, upon exposure to several of the reference compounds. We also observed aberrant gene expression using fluorescent reporters, including SOX2, BRA, and SOX17, suggestive of multi-lineage differentiation defects and disrupted axial patterning. Finally, we saw that gastruloids recapitulated some of the known in vivo species-specific susceptibilities between their mouse and human counterparts. We therefore suggest that gastruloids represent a powerful tool for teratogenicity assessment by enabling relevant physiological recapitulation of early embryonic development, demonstrating their use as a novel in vitro teratogenic model system.",10.1016/j.reprotox.2021.08.003,34425190,"Animals; Cells, Cultured; Embryo, Mammalian; Gastrula; Gastrulation; Human Embryonic Stem Cells; Humans; Mice; Mouse Embryonic Stem Cells; Organoids; Teratogens",8522962.0
2021,Fate-Patterning of 2D Gastruloids and Ectodermal Colonies Using Micropatterned Human Pluripotent Stem Cells.,"Britton George, Chhabra Sapna, Massey Joseph, Warmflash Aryeh","Methods in molecular biology (Clifton, N.J.)",human,,Primitive streak / mesoderm induction; Germ layer specification; Self-organization,,"In the developing mammalian embryo, intercellular signaling allows cells to self-organize to create spatial patterns of different cell fates. This process is challenging to study because of the difficulty of observing or manipulating embryos on the spatial and temporal scales required. In vitro models can provide a complement to in vivo systems for addressing these issues. These models are also the only windows we have into early human development. Here we provide protocols for two systems based on differentiating human pluripotent stem cells in micropatterned colonies on defined size and shape. The first model replicates the patterning of the germ layers at gastrulation, while the second replicates the medial-lateral patterning of the ectoderm. These systems allow study of how signaling underlies self-organized patterning at stages of development which are otherwise inaccessible.",10.1007/978-1-0716-1174-6_9,33340358,"Cell Communication; Cell Differentiation; Cell Lineage; Cell Shape; Cell Size; Cells, Cultured; Ectoderm; Fluorescent Antibody Technique; Gastrulation; Gene Expression Regulation, Developmental; Human Embryonic Stem Cells; Humans; Microscopy, Fluorescence; Signal Transduction; Time Factors",
2021,Co-development of central and peripheral neurons with trunk mesendoderm in human elongating multi-lineage organized gastruloids.,"Olmsted Zachary T, Paluh Janet L",Nature communications,human,,Elongation; Germ layer specification,,"Stem cell technologies including self-assembling 3D tissue models provide access to early human neurodevelopment and fundamental insights into neuropathologies. Gastruloid models have not been used to investigate co-developing central and peripheral neuronal systems with trunk mesendoderm which we achieve here in elongating multi-lineage organized (EMLO) gastruloids. We evaluate EMLOs over a forty-day period, applying immunofluorescence of multi-lineage and functional biomarkers, including day 16 single-cell RNA-Seq, and evaluation of ectodermal and non-ectodermal neural crest cells (NCCs). We identify NCCs that differentiate to form peripheral neurons integrated with an upstream spinal cord region after day 8. This follows initial EMLO polarization events that coordinate with endoderm differentiation and primitive gut tube formation during multicellular spatial reorganization. This combined human central-peripheral nervous system model of early organogenesis highlights developmental events of mesendoderm and neuromuscular trunk regions and enables systemic studies of tissue interactions and innervation of neuromuscular, enteric and cardiac relevance.",10.1038/s41467-021-23294-7,34021144,Biomarkers; Cell Differentiation; Central Nervous System; Forkhead Transcription Factors; Gene Expression; Humans; Morphogenesis; Neural Crest; Peripheral Nervous System; Phenotype; SOXE Transcription Factors; Transcription Factor AP-2,8140076.0
2021,Gene expression dynamics underlying cell fate emergence in 2D micropatterned human embryonic stem cell gastruloids.,"Minn Kyaw Thu, Dietmann Sabine, Waye Sarah E, Morris Samantha A, Solnica-Krezel Lilianna",Stem cell reports,human,Wnt; Nodal; BMP,Primitive streak / mesoderm induction; Germ layer specification; Inside-outside / radial patterning,bmp4; cripto; nodal; wnt,"Human embryonic stem cells cultured in 2D micropatterns with BMP4 differentiate into a radial arrangement of germ layers and extraembryonic cells. Single-cell transcriptomes demonstrate generation of cell types transcriptionally similar to their in vivo counterparts in Carnegie stage 7 human gastrula. Time-course analyses indicate sequential differentiation, where the epiblast arises by 12 h between the prospective ectoderm in the center and the cells initiating differentiation toward extraembryonic fates at the edge. Extraembryonic and mesendoderm precursors arise from the epiblast by 24 h, while nascent mesoderm, endoderm, and primordial germ cell-like cells form by 44 h. Dynamic changes in transcripts encoding signaling components support a BMP, WNT, and Nodal hierarchy underlying germ-layer specification conserved across mammals, and FGF and HIPPO pathways being active throughout differentiation. This work also provides a resource for mining genes and pathways expressed in a stereotyped 2D gastruloid model, common with other species or unique to human gastrulation.",10.1016/j.stemcr.2021.03.031,33891870,"Amnion; Cell Culture Techniques; Cell Differentiation; Cell Lineage; Gastrula; Gastrulation; Gene Expression Regulation, Developmental; Germ Cells; Germ Layers; Human Embryonic Stem Cells; Humans; Mesoderm; Primitive Streak; Signal Transduction; Time Factors; Transcription, Genetic",8185470.0
2021,Membrane Tension Gates ERK-Mediated Regulation of Pluripotent Cell Fate.,"De Belly Henry, Stubb Aki, Yanagida Ayaka, Labouesse Céline, Jones Philip H, Paluch Ewa K, Chalut Kevin J",Cell stem cell,mouse,Wnt; FGF,Germ layer specification,fgf signaling; β-catenin,"Cell fate transitions are frequently accompanied by changes in cell shape and mechanics. However, how cellular mechanics affects the instructive signaling pathways controlling cell fate is poorly understood. To probe the interplay between shape, mechanics, and fate, we use mouse embryonic stem cells (ESCs), which change shape as they undergo early differentiation. We find that shape change is regulated by a β-catenin-mediated decrease in RhoA activity and subsequent decrease in the plasma membrane tension. Strikingly, preventing a decrease in membrane tension results in early differentiation defects in ESCs and gastruloids. Decreased membrane tension facilitates the endocytosis of FGF signaling components, which activate ERK signaling and direct the exit from the ESC state. Increasing Rab5a-facilitated endocytosis rescues defective early differentiation. Thus, we show that a mechanically triggered increase in endocytosis regulates early differentiation. Our findings are of fundamental importance for understanding how cell mechanics regulates biochemical signaling and therefore cell fate.",10.1016/j.stem.2020.10.018,33217323,Animals; Cell Differentiation; Embryonic Stem Cells; Endocytosis; Mice; Mouse Embryonic Stem Cells; Signal Transduction,7875115.0
2021,Reaction-diffusion models for morphological patterning of hESCs.,"Bedekar Prajakta, Timofeyev Ilya, Warmflash Aryeh, Perepelitsa Misha",Journal of mathematical biology,human,Wnt; Nodal; BMP,Self-organization,bmp4; nodal; wnt,"In this paper we consider mathematical modeling of the dynamics of self-organized patterning of spatially confined human embryonic stem cells (hESCs) treated with BMP4 (gastruloids) described in recent experimental works (Warmflash in Nat Methods 11:847-854, 2014; Chhabra in PloS Biol 17: 3000498, 2019). In the first part of the paper we use the activator-inhibitor equations of Gierer and Meinhardt to identify 3 reaction-diffusion regimes for each of the three morphogenic proteins, BMP4, Wnt and Nodal, based on the characteristic features of the dynamic patterning. We identify appropriate boundary conditions which correspond to the experimental setup and perform numerical simulations of the reaction-diffusion (RD) systems, using the finite element approximation, to confirm that the RD systems in these regimes produce realistic dynamics of the protein concentrations. In the second part of the paper we use analytic tools to address the questions of the existence and stability of non-homogeneous steady states for the reaction-diffusion systems of the type considered in the first part of the paper.",10.1007/s00285-021-01674-3,34727234,"Diffusion; Human Embryonic Stem Cells; Humans; Models, Biological; Morphogenesis",
2021,Gastruloid Development Competence Discriminates Different States of Pluripotency.,"Cermola Federica, D'Aniello Cristina, Tatè Rosarita, De Cesare Dario, Martinez-Arias Alfonso, Minchiotti Gabriella, Patriarca Eduardo Jorge",Stem cell reports,mouse,,Elongation,,"Floating spheroidal aggregates of mouse embryonic stem cells can develop into polarized/elongated organoids, namely gastruloids. We set up a high-performing assay to measure gastruloid formation efficiency (GFE), and found that GFE decreases as pluripotency progresses from naive (GFE ≥ 95%) to primed (GFE = 0) state. Specifically, we show that primed EpiSCs fail to generate proper cell aggregates, while early-primed EpiLCs aggregate but eventually fail to develop into elongated gastruloids. Moreover, we characterized proline-induced cells (PiCs), a LIF-dependent reversible early-primed state of pluripotency, and show that PiCs are able to generate gastruloids (GFE ∼ 50%) and are also competent to differentiate into primordial germ cell-like cells. Thus, we propose the GFE assay as a valuable functional tool to discriminate different states of the pluripotency continuum.",10.1016/j.stemcr.2020.12.013,33482102,"Animals; Cell Differentiation; Embryonic Development; Epidermal Growth Factor; Germ Layers; Membrane Glycoproteins; Mice; Mice, Knockout; Mouse Embryonic Stem Cells; Neoplasm Proteins; Organogenesis; Organoids; Pluripotent Stem Cells",7878839.0
2021,Depletion of aneuploid cells in human embryos and gastruloids.,"Yang Min, Rito Tiago, Metzger Jakob, Naftaly Jeffrey, Soman Rohan, Hu Jianjun, Albertini David F, Barad David H, Brivanlou Ali H, Gleicher Norbert",Nature cell biology,human,BMP,Germ layer specification,bmp4,"Chromosomal instability leading to aneuploidy is pervasive in early human embryos<sup>1-3</sup> and is considered as a major cause of infertility and pregnancy wastage<sup>4,5</sup>. Here we provide several lines of evidence that blastocysts containing aneuploid cells are worthy of in vitro fertilization transfer. First, we show clinically that aneuploid embryos can lead to healthy births, suggesting the presence of an in vivo mechanism to eliminate aneuploidy. Second, early development and cell specification modelled in micropatterned human 'gastruloids' grown in confined geometry show that aneuploid cells are depleted from embryonic germ layers, but not from extraembryonic tissue, by apoptosis in a bone morphogenetic protein 4 (BMP4)-dependent manner. Third, a small percentage of euploid cells rescues embryonic tissue in mosaic gastruloids when mixed with aneuploid cells. Finally, single-cell RNA-sequencing analysis of early human embryos revealed a decline of aneuploidy beginning on day 3. Our findings challenge two current dogmas: that a single trophectoderm biopsy at blastocyst stage to perform prenatal genetic testing can accurately determine the chromosomal make-up of a human embryo, and that aneuploid embryos should be withheld from embryo transfer in association with in vitro fertilization.",10.1038/s41556-021-00660-7,33837289,"Aneuploidy; Biopsy; Blastocyst; Bone Morphogenetic Protein 4; Chromosomal Instability; Chromosomes; Embryo Implantation; Embryo, Mammalian; Female; Fertilization in Vitro; Humans; Infertility; Mosaicism; Pregnancy",
2021,"Human Embryos, Induced Pluripotent Stem Cells, and Organoids: Models to Assess the Effects of Environmental Plastic Pollution.","Miloradovic Dragana, Pavlovic Dragica, Jankovic Marina Gazdic, Nikolic Sandra, Papic Milos, Milivojevic Nevena, Stojkovic Miodrag, Ljujic Biljana",Frontiers in cell and developmental biology,human,,Self-organization,,"For a long time, animal models were used to mimic human biology and diseases. However, animal models are not an ideal solution due to numerous interspecies differences between humans and animals. New technologies, such as human-induced pluripotent stem cells and three-dimensional (3D) cultures such as organoids, represent promising solutions for replacing, refining, and reducing animal models. The capacity of organoids to differentiate, self-organize, and form specific, complex, biologically suitable structures makes them excellent <i>in vitro</i> models of development and disease pathogenesis, as well as drug-screening platforms. Despite significant potential health advantages, further studies and considerable nuances are necessary before their clinical use. This article summarizes the definition of embryoids, gastruloids, and organoids and clarifies their appliance as models for early development, diseases, environmental pollution, drug screening, and bioinformatics.",10.3389/fcell.2021.709183,34540831,,8446652.0
2021,3D gastruloids: a novel frontier in stem cell-based in vitro modeling of mammalian gastrulation.,"van den Brink Susanne C, van Oudenaarden Alexander",Trends in cell biology,mammalian,,Primitive streak / mesoderm induction,,"3D gastruloids, aggregates of embryonic stem cells that recapitulate key aspects of gastrula-stage embryos, have emerged as a powerful tool to study the early stages of mammalian post-implantation development in vitro. Owing to their tractable nature and the relative ease by which they can be generated in large numbers, 3D gastruloids provide an unparalleled opportunity to study normal and pathological embryogenesis from a bottom-up perspective and in a high-throughput manner. Here, we review how gastruloid models can be exploited to deepen our understanding of mammalian development. In addition, we discuss current limitations, potential clinical applications, and ethical implications of this emerging model system.",10.1016/j.tcb.2021.06.007,34304959,"Animals; Embryonic Development; Embryonic Stem Cells; Gastrula; Gastrulation; Models, Biological",
2021,Capturing Cardiogenesis in Gastruloids.,"Rossi Giuliana, Broguiere Nicolas, Miyamoto Matthew, Boni Andrea, Guiet Romain, Girgin Mehmet, Kelly Robert G, Kwon Chulan, Lutolf Matthias P",Cell stem cell,mouse,,Self-organization,,"Organoids are powerful models for studying tissue development, physiology, and disease. However, current culture systems disrupt the inductive tissue-tissue interactions needed for the complex morphogenetic processes of native organogenesis. Here, we show that mouse embryonic stem cells (mESCs) can be coaxed to robustly undergo fundamental steps of early heart organogenesis with an in-vivo-like spatiotemporal fidelity. These axially patterned embryonic organoids (gastruloids) mimic embryonic development and support the generation of cardiovascular progenitors, including first and second heart fields. The cardiac progenitors self-organize into an anterior domain reminiscent of a cardiac crescent before forming a beating cardiac tissue near a putative primitive gut-like tube, from which it is separated by an endocardial-like layer. These findings unveil the surprising morphogenetic potential of mESCs to execute key aspects of organogenesis through the coordinated development of multiple tissues. This platform could be an excellent tool for studying heart development in unprecedented detail and throughput.",10.1016/j.stem.2020.10.013,33176168,Animals; Embryonic Development; Heart; Mice; Mouse Embryonic Stem Cells; Organogenesis; Organoids,7867643.0
2021,Generation of Mouse Pluripotent Stem Cell-derived Trunk-like Structures: An <i>in vitro</i> Model of Post-implantation Embryogenesis.,"Bolondi Adriano, Haut Leah, Gassaloglu Seher Ipek, Burton Polly, Kretzmer Helene, Buschow René, Meissner Alexander, Herrmann Bernhard G, Veenvliet Jesse V",Bio-protocol,mouse,,Self-organization,,"Post-implantation mammalian embryogenesis involves profound molecular, cellular, and morphogenetic changes. The study of these highly dynamic processes is complicated by the limited accessibility of <i>in utero</i> development. In recent years, several complementary <i>in vitro</i> systems comprising self-organized assemblies of mouse embryonic stem cells, such as gastruloids, have been reported. We recently demonstrated that the morphogenetic potential of gastruloids can be further unlocked by the addition of a low percentage of Matrigel as an extracellular matrix surrogate. This resulted in the formation of highly organized trunk-like structures (TLSs) with a neural tube that is frequently flanked by bilateral somites. Notably, development at the molecular and morphogenetic levels is highly reminiscent of the natural embryo. To facilitate access to this powerful model, here we provide a detailed step-by-step protocol that should allow any lab with access to standard cell culture techniques to implement the culture system. This will provide the user with a means to investigate early mid-gestational mouse embryogenesis at an unprecedented spatiotemporal resolution.",10.21769/BioProtoc.4042,34250208,,8250383.0
2021,Stem Cell Neurodevelopmental Solutions for Restorative Treatments of the Human Trunk and Spine.,"Olmsted Zachary T, Paluh Janet L",Frontiers in cellular neuroscience,both,,Experimental variability / robustness,,"The ability to reliably repair spinal cord injuries (SCI) will be one of the greatest human achievements realized in regenerative medicine. Until recently, the cellular path to this goal has been challenging. However, as detailed developmental principles are revealed in mouse and human models, their application in the stem cell community brings trunk and spine embryology into efforts to advance human regenerative medicine. New models of posterior embryo development identify neuromesodermal progenitors (NMPs) as a major bifurcation point in generating the spinal cord and somites and is leading to production of cell types with the full range of axial identities critical for repair of trunk and spine disorders. This is coupled with organoid technologies including assembloids, circuitoids, and gastruloids. We describe a paradigm for applying developmental principles towards the goal of cell-based restorative therapies to enable reproducible and effective near-term clinical interventions.",10.3389/fncel.2021.667590,33981202,,8107236.0
2020,High-resolution transcriptional and morphogenetic profiling of cells from micropatterned human ESC gastruloid cultures.,"Minn Kyaw Thu, Fu Yuheng C, He Shenghua, Dietmann Sabine, George Steven C, Anastasio Mark A, Morris Samantha A, Solnica-Krezel Lilianna",eLife,both,Nodal; BMP,Primitive streak / mesoderm induction; Germ layer specification; Inside-outside / radial patterning; Experimental variability / robustness,bmp4; cripto,"During mammalian gastrulation, germ layers arise and are shaped into the body plan while extraembryonic layers sustain the embryo. Human embryonic stem cells, cultured with BMP4 on extracellular matrix micro-discs, reproducibly differentiate into gastruloids, expressing markers of germ layers and extraembryonic cells in radial arrangement. Using single-cell RNA sequencing and cross-species comparisons with mouse, cynomolgus monkey gastrulae, and post-implantation human embryos, we reveal that gastruloids contain cells transcriptionally similar to epiblast, ectoderm, mesoderm, endoderm, primordial germ cells, trophectoderm, and amnion. Upon gastruloid dissociation, single cells reseeded onto micro-discs were motile and aggregated with the same but segregated from distinct cell types. Ectodermal cells segregated from endodermal and extraembryonic but mixed with mesodermal cells. Our work demonstrates that the gastruloid system models primate-specific features of embryogenesis, and that gastruloid cells exhibit evolutionarily conserved sorting behaviors. This work generates a resource for transcriptomes of human extraembryonic and embryonic germ layers differentiated in a stereotyped arrangement.",10.7554/eLife.59445,33206048,"Basic Helix-Loop-Helix Proteins; Body Patterning; Bone Morphogenetic Protein 4; Cell Adhesion Molecules; Cell Culture Techniques; Cell Differentiation; Cell Line; Cells, Cultured; Embryonic Stem Cells; Gastrula; Gene Expression Regulation, Developmental; Humans; Transcription Factor AP-2; Transcription, Genetic; Wnt Proteins",7728446.0
2020,Measuring and Modeling Single-Cell Heterogeneity and Fate Decision in Mouse Embryos.,"Fiorentino Jonathan, Torres-Padilla Maria-Elena, Scialdone Antonio",Annual review of genetics,mouse,,Primitive streak / mesoderm induction; Germ layer specification,,"Cellular heterogeneity is a property of any living system; however, its relationship with cellular fate decision remains an open question. Recent technological advances have enabled valuable insights, especially in complex systems such as the mouse embryo. In this review, we discuss recent studies that characterize cellular heterogeneity at different levels during mouse development, from the two-cell stage up to gastrulation. In addition to key experimental findings, we review mathematical modeling approaches that help researchers interpret these findings. Disentangling the role of heterogeneity in cell fate decision will likely rely on the refined integration of experiments, large-scale omics data, and mathematical modeling, complemented by the use of synthetic embryos and gastruloids as promising in vitro models.",10.1146/annurev-genet-021920-110200,32867543,"Animals; Cell Differentiation; Embryo, Mammalian; Humans; Mice",
2020,Translating Embryogenesis to Generate Organoids: Novel Approaches to Personalized Medicine.,"Sahu Sounak, Sharan Shyam K",iScience,human,,Self-organization; Experimental variability / robustness,,"The astounding capacity of pluripotent stem cells (PSCs) to differentiate and self-organize has revolutionized the development of 3D cell culture models. The major advantage is its ability to mimic <i>in vivo</i> microenvironments and cellular interactions when compared with the classical 2D cell culture models. Recent innovations in generating embryo-like structures (including blastoids and gastruloids) from PSCs have advanced the experimental accessibility to understand embryogenesis with immense potential to model human development. Taking cues on how embryonic development leads to organogenesis, PSCs can also be directly differentiated to form mini-organs or organoids of a particular lineage. Organoids have opened new avenues to augment our understanding of stem cell and regenerative biology, tissue homeostasis, and disease mechanisms. In this review, we provide insights from developmental biology with a comprehensive resource of signaling pathways that in a coordinated manner form embryo-like structures and organoids. Moreover, the advent of assembloids and multilineage organoids from PSCs opens a new dimension to study paracrine function and multi-tissue interactions <i>in vitro</i>. Although this led to an avalanche of enthusiasm to utilize organoids for organ transplantation studies, we examine the current limitations and provide perspectives to improve reproducibility, scalability, functional complexity, and cell-type characterization. Taken together, these 3D <i>in vitro</i> organ-specific and patient-specific models hold great promise for drug discovery, clinical management, and personalized medicine.",10.1016/j.isci.2020.101485,32864586,,7441954.0
